{
  "min_characters": 80,
  "max_characters": 100,
  "banned_expressions": [
    "最",
    "绝对",
    "全网最低",
    "补贴",
    "0元购",
    "免单",
    "秒杀",
    "限时疯抢",
    "比超市便宜",
    "闭眼入",
    "快冲",
    "姐妹们",
    "家人们",
    "冲就完了"
  ],
  "call_to_actions": [],
  "required_ending_call_to_actions": [
    "点下方链接看看。",
    "链接在下面，还没吃饭的宝宝们点进去看看。",
    "点开下面的链接看看吧。",
    "点链接进去瞧瞧吧。",
    "下方链接，没想好吃什么的点进去看看。",
    "链接放底下了，饿了的宝宝点开看看。",
    "下面链接，点进去挑挑看。",
    "点开下方链接，进去逛逛吧。",
    "链接在底下，感兴趣的宝宝点进去看看。"
  ],
  "format_prefixes": [
    "#",
    "-",
    "*",
    "1.",
    "1、",
    "①"
  ]
}
