{
  "min_characters": 80,
  "max_characters": 100,
  "banned_expressions": [
    "最",
    "绝对",
    "全网最低",
    "补贴",
    "0元购",
    "免单",
    "秒杀",
    "限时疯抢",
    "比超市便宜",
    "闭眼入",
    "快冲",
    "姐妹们",
    "家人们",
    "冲就完了"
  ],
  "call_to_actions": [
    "点击视频下方链接",
    "点击左下角链接",
    "点链接",
    "立即购买",
    "赶紧下单",
    "链接就在下方",
    "官方链接就在左下角",
    "下单",
    "点击购买",
    "赶紧冲",
    "快叫上",
    "直播间"
  ],
  "format_prefixes": [
    "#",
    "-",
    "*",
    "1.",
    "1、",
    "①"
  ]
}
